{
  "schema_version": 1,
  "artifact_kind": "hajimi-mv-theme",
  "theme_id": "rain-window-coral-v1",
  "preset": "hajimi-rain-window-v1",
  "display": {
    "title": "百年孤寂",
    "title_en": "Century of Solitude",
    "artist_label": "王菲 / Faye Wong",
    "version": "HAJIMI NOTE / EVENT V1",
    "credit": "HAJIMI REMIX",
    "status": "INTERNAL AUTO-DRAFT PREVIEW / HUMAN LISTENING PENDING"
  },
  "canvas": {
    "width": 1080,
    "height": 1920,
    "fps": 30,
    "safe_area_px": 72,
    "top_visual_height_px": 870,
    "footer_height_px": 140
  },
  "palette": {
    "ink": "#1A1A1A",
    "cream": "#F5F0E8",
    "cream_dark": "#E8E0D4",
    "coral": "#E85D5D",
    "coral_dark": "#D44A4A",
    "gray": "#6B6B6B",
    "light_gray": "#B0B0B0"
  },
  "typography": {
    "display": "Inter, Arial Narrow, sans-serif",
    "cjk_display": "Songti SC, STSong, serif",
    "body": "Inter, PingFang SC, sans-serif",
    "mono": "SFMono-Regular, Menlo, monospace",
    "font_preflight_status": "PASS"
  },
  "layout": {
    "top_window": {
      "x": 72,
      "y": 160,
      "width": 936,
      "height": 650,
      "border_px": 4
    },
    "window_inner": {
      "x": 76,
      "y": 164,
      "width": 928,
      "height": 642
    },
    "lower_content": {
      "x": 72,
      "y": 870,
      "width": 936,
      "height": 910
    },
    "footer": {
      "x": 72,
      "y": 1780,
      "width": 936,
      "height": 140
    }
  },
  "visual_media": {
    "mode": "source_mv_window",
    "manifest_path": "data/visual.json",
    "muted": true,
    "fit": "pre_cropped_cover"
  },
  "audio_reactivity": {
    "source": "data/audio-bands.json",
    "runtime_analysis": false,
    "fps": 30,
    "band_count": 16
  },
  "constraints": [
    "No remote runtime assets",
    "One continuous muted video element",
    "One authoritative root audio element",
    "Maximum one active lyric token",
    "No runtime ASR FFT F0 random or network work"
  ]
}
